{"ai_assurance":{"assurance_case_id":"assurance-credit-2026-001","assurance_outcome":"portable-evidence-ready","control_summaries":[{"control_id":"control-human-review","control_type":"review","status":"active","title":"Human underwriting review"},{"control_id":"control-evidence-retention","control_type":"retention","status":"active","title":"Evidence retention and trace export"}],"decision_traceability":"Decision source, proof artifact, risk registry, and control registry are linked through the bundle manifest.","human_review_status":"completed","linked_axle_artifact_path":"axle.json","linked_coverage_case_ids":["cov-prof-liability-2026-001"],"linked_exposure_ids":["exp-credit-2026-001"],"model_identifier":"credit-policy-screen-v2","referenced_control_ids":["control-human-review","control-evidence-retention"],"referenced_risk_ids":["risk-model-drift","risk-missing-human-review"],"risk_summaries":[{"risk_id":"risk-model-drift","severity":"high","status":"open","title":"Model drift in policy score interpretation"},{"risk_id":"risk-missing-human-review","severity":"high","status":"monitored","title":"Decision released without mandatory human review"}],"system_identifier":"credit-review-orchestrator"},"banking":{"control_summaries":[{"control_id":"control-human-review","control_type":"review","status":"active","title":"Human underwriting review"},{"control_id":"control-evidence-retention","control_type":"retention","status":"active","title":"Evidence retention and trace export"}],"counterparty":"Acme Fabrication LLC","currency":"USD","decision_context":"Small-business credit review for a conditional approval workflow.","decision_outcome":"conditional-approval","exposure_amount":"250000","exposure_id":"exp-credit-2026-001","governing_policy_refs":["credit-policy-v3","model-risk-standard-v1"],"product_type":"working-capital-line","referenced_control_ids":["control-human-review","control-evidence-retention"],"referenced_risk_ids":["risk-model-drift","risk-missing-human-review"],"review_status":"committee-reviewed","risk_summaries":[{"risk_id":"risk-model-drift","severity":"high","status":"open","title":"Model drift in policy score interpretation"},{"risk_id":"risk-missing-human-review","severity":"high","status":"monitored","title":"Decision released without mandatory human review"}]},"insurance":{"control_summaries":[{"control_id":"control-human-review","control_type":"review","status":"active","title":"Human underwriting review"},{"control_id":"control-evidence-retention","control_type":"retention","status":"active","title":"Evidence retention and trace export"}],"coverage_case_id":"cov-prof-liability-2026-001","coverage_context":"Professional liability review for AI-assisted credit decisions.","coverage_type":"professional-liability","decision_outcome":"coverage-confirmed","insured_amount":"250000","insured_party":"Acme Fabrication LLC","policy_refs":["prof-liability-policy-v2"],"referenced_control_ids":["control-human-review","control-evidence-retention"],"referenced_risk_ids":["risk-model-drift","risk-missing-human-review"],"review_status":"underwriter-reviewed","risk_summaries":[{"risk_id":"risk-model-drift","severity":"high","status":"open","title":"Model drift in policy score interpretation"},{"risk_id":"risk-missing-human-review","severity":"high","status":"monitored","title":"Decision released without mandatory human review"}]},"legal_governance":{"compliance_posture":"internally-compliant","control_summaries":[{"control_id":"control-human-review","control_type":"review","status":"active","title":"Human underwriting review"},{"control_id":"control-evidence-retention","control_type":"retention","status":"active","title":"Evidence retention and trace export"}],"governing_authority_refs":["internal-governance-manual-v4","records-retention-standard-v2"],"liability_posture":"controlled-with-human-approval","linked_assurance_case_ids":["assurance-credit-2026-001"],"linked_coverage_case_ids":["cov-prof-liability-2026-001"],"linked_exposure_ids":["exp-credit-2026-001"],"matter_id":"matter-governance-2026-001","referenced_control_ids":["control-human-review","control-evidence-retention"],"referenced_risk_ids":["risk-model-drift","risk-missing-human-review"],"rights_and_duties_summary":"The institution must preserve adverse-decision evidence, document reviewer intervention, and maintain traceable supporting artifacts.","risk_summaries":[{"risk_id":"risk-model-drift","severity":"high","status":"open","title":"Model drift in policy score interpretation"},{"risk_id":"risk-missing-human-review","severity":"high","status":"monitored","title":"Decision released without mandatory human review"}]},"schema_version":"v0"}